<?xml version="1.0" encoding="UTF-8"?>
<contentTemplate id="" xmlns:xsi="http://www.w3.org/2001/XMLSchema-instance" xsi:noNamespaceSchemaLocation="content-template.xsd">
  <dataDefinition>
    <container id="" label="" qualifiedId="" refData="false" referenceable="true" single="false">
      <contentItem id="" label="" qualifiedId="" type="text">
        <text/>
      </contentItem>
      <container id="" label="" qualifiedId="" refData="false" referenceable="true" single="false"/>
    </container>
  </dataDefinition>
  <uiDefinition>
    <contentUIDef qualifiedId="">
      <container labelQualifiedId="">
        <enclosure label="">
          <childContainer id=""/>
        </enclosure>
      </container>
    </contentUIDef>
  </uiDefinition>
</contentTemplate>
